<!ELEMENT fabricantes (fabricante+)>
<!ELEMENT fabricante (fundador , pais, modelos )>
<!ATTLIST fabricante 
id CDATA #REQUIRED 
logo CDATA #REQUIRED>
<!ELEMENT fundador (#PCDATA )>
<!ATTLIST fundador desde CDATA #IMPLIED>
<!ELEMENT pais (#PCDATA )>
<!ELEMENT modelos (modelo+)>
<!ELEMENT modelo (nombre, segmento, inicio)>
<!ELEMENT nombre (#PCDATA)>
<!ELEMENT segmento (#PCDATA)>
<!ELEMENT inicio (#PCDATA)>
